{
  "_meta": {
    "schema_version": "aim-review-v1.0",
    "reviewer_model": "sonar-pro",
    "monitor_slug": "ai-governance",
    "reviewed_at": "2026-04-23T20:14:31.606505+00:00",
    "reviewed_from": "aim-interpret-v1.0",
    "reviewed_from_file": "interpret-latest.json",
    "interpret_meta": {
      "null_signal_week": false,
      "cycle_disposition": "material_change",
      "week_ending": "2026-04-23"
    },
    "reviewer_flags": [],
    "reviewer_error": false,
    "reviewer_error_reason": null,
    "independence_mechanism": {
      "distinct_model_family": {
        "reviewer_model": "sonar-pro",
        "interpreter_model": "sonar-deep-research"
      },
      "first_principles_source_re_read": true
    }
  },
  "verdict": "APPROVE_WITH_FLAGS",
  "verdict_reason": "soft checks failed: ['R6']",
  "checks": [
    {
      "check_id": "R1",
      "name": "schema validates against aim-interpret-v1.0",
      "result": "PASS",
      "disposition_aware_skip": false,
      "detail": "schema_version ok; 20 claims"
    },
    {
      "check_id": "R2",
      "name": "_meta.cycle_disposition in enum",
      "result": "PASS",
      "disposition_aware_skip": false,
      "detail": "cycle_disposition=material_change"
    },
    {
      "check_id": "R3",
      "name": "structured_claims[] shape integrity",
      "result": "PASS",
      "disposition_aware_skip": false,
      "detail": "all 20 claims carry 8 required keys"
    },
    {
      "check_id": "R4",
      "name": "evidence_id non-empty on every claim",
      "result": "PASS",
      "disposition_aware_skip": false,
      "detail": "all 20 claims carry evidence_id"
    },
    {
      "check_id": "R5",
      "name": "gaps_register[] non-empty when null_signal_week",
      "result": "SKIP",
      "disposition_aware_skip": true,
      "detail": "skipped — null_signal_week is false"
    },
    {
      "check_id": "R6",
      "name": "triple_extraction_manifest self-consistent",
      "result": "FAIL",
      "disposition_aware_skip": false,
      "detail": "det(142) + llm(18) = 160 != claims(20)"
    },
    {
      "check_id": "R7",
      "name": "persistent-state modules non-empty",
      "result": "PASS",
      "disposition_aware_skip": false,
      "detail": "jurisdiction_risk_matrix + lab_posture_scorecard non-empty"
    }
  ],
  "claim_flags": [],
  "advisory_notes": [
    "R6 failure indicates significant extraction discrepancy (160 expected vs 20 claims); Composer should verify if structured_claims[] underrepresents material changes from modules like module_7 risk vectors or module_4 sectors.",
    "High concentration of claims from module_7 (7/20) and module_2 (4/20); evidence base skewed toward risk indicators and models, potentially under-diversifying brief coverage of jurisdiction_risk_matrix updates.",
    "module_13 has content contradicting identity card ('no material developments never acceptable'); Composer may need to amplify AI&Society signals like observability shift."
  ]
}